{
  "$schema": "../skill.schema.json",
  "name": "plan-before-code",
  "title": "Plan Before Code",
  "description": "Use before coding a non-trivial request (feature, bug fix, refactor, integration): clarify only decisions that change the outcome, write a short persistent TODO grouped by feature, and update item status as you go. Skip trivial edits.",
  "interface": {
    "displayName": "Plan Before Code",
    "shortDescription": "Clarify requirements and track TODOs before coding",
    "defaultPrompt": "Use $plan-before-code before starting this development request to clarify scope, write a TODO document, and keep task status updated."
  },
  "summary": "Apply this before implementation begins. The skill turns an initial user request into a clarified scope, a persistent hierarchical development TODO document, a concise user-facing summary, and an execution loop where each TODO status is updated as work completes.",
  "whenToUse": [
    "开始任何非平凡项目需求、代码修改、bug 修复、feature、refactor、配置变更或测试补充之前。",
    "用户需求可能跨多个文件、多个步骤、多个系统边界或需要取舍判断。",
    "需要先判断用户目标、验收标准、范围限制、数据/权限/交互边界是否清楚。",
    "需要把开发计划按需求功能维度分层沉淀成文档，并在执行过程中持续更新 TODO 状态。"
  ],
  "avoidWhen": [
    "用户只是要求解释概念、阅读代码、翻译文本、运行一个简单命令或回答一个不涉及项目修改的问题。",
    "改动极小且用户明确要求直接处理；这种情况下可用一句内联计划替代完整 TODO 文档，但仍要保留必要假设。",
    "已有用户确认过的开发 TODO 文档且本次只是继续执行其中一个明确任务，此时应更新原文档而不是重建计划。"
  ],
  "triggerSignals": [
    "需求 实现 功能 feature 加一个 做一个 开发一个 开发 修改 修复 重构 refactor 接入 构建 优化 迁移",
    "开始 开始前 澄清 计划 plan 开发计划 todo 需求文档 任务拆分 拆解 排期 范围",
    "项目 需求 不确定 验收 边界 兼容 unclear requirement 需求不清",
    "non-trivial 多步骤 多文件 跨模块 取舍 选型 复杂改动"
  ],
  "workflow": [
    "先重建需求理解：列出用户目标、显式要求、隐含验收点、限制条件、已有上下文和不能擅自触碰的范围。",
    "执行澄清门禁：只有当不确定点会改变架构、数据、用户可见行为、不可逆操作、验收标准或验证路径时才询问用户。",
    "询问时一次合并 1 到 3 个高价值问题；对可安全假设的问题直接说明假设并继续，避免为了完美信息反复打断用户。",
    "需求清楚后创建或更新开发 TODO 文档，先按用户可感知的需求功能维度拆出一级功能块，再在每个功能块下拆出原子化子 TODO 和必要的孙 TODO。",
    "保证每个原子 TODO 都可单独执行、可预测结果、上下文尽量纯净，并能对应明确文件变更、验证动作或用户可见行为。",
    "向用户简短概述一级功能块、关键原子 TODO 和执行顺序；除非用户要求先审批计划，否则开始按 TODO 开发。",
    "每开始一个原子 TODO，先把文档中对应状态改为 in_progress；完成后立刻改为 done，并补充完成证据、关键文件或验证结果。",
    "如果开发中发现新事实、范围变化或阻塞，先更新文档中的假设、状态和后续 TODO，再继续执行或向用户请求决策。"
  ],
  "preferredMoves": [
    "先读仓库和已有上下文来消除疑问，不把能自己确认的问题抛给用户。",
    "把澄清问题压缩成少量决策点，让用户只回答会改变实现方向的信息。",
    "默认把 TODO 文档放在仓库已有规划文档目录；没有约定时使用 `docs/todos/YYYY-MM-DD-<slug>.md` 或 `.svton/todos/YYYY-MM-DD-<slug>.md`。",
    "先按需求功能维度拆一级 TODO，再把每个功能块继续拆成小到可独立验证的原子 TODO。",
    "把原子 TODO 写成可执行工作单元，每一项都能对应文件变更、验证动作或用户可见结果。",
    "同时使用运行时 plan 工具和文档时，以文档作为持久记录，保持两边状态一致。"
  ],
  "rules": [
    "非平凡项目修改开始前必须先完成需求理解和 TODO 文档沉淀；不能直接跳进代码而丢掉用户约束。",
    "不得为了形式感追问用户；只有阻塞决策或高风险假设才需要澄清。",
    "如果选择带假设继续，必须把假设写进 TODO 文档，并在最终交付时保持可追溯。",
    "TODO 文档必须先按需求功能维度分组，再在组内拆出原子化子 TODO；跨功能共享的准备项或验证项也必须明确归属或单独成组。",
    "原子 TODO 必须尽量只依赖一个清晰上下文、一个预期结果和一个验证信号；不能把多个不相关改动塞进同一个原子项。",
    "TODO 文档必须包含状态字段，状态只使用 pending、in_progress、done、blocked、dropped 等清晰值。",
    "每完成一个原子 TODO 必须马上更新文档状态；一级功能块状态要由其子项状态汇总，不能手动伪造完成。",
    "计划变更、发现阻塞或需求被重新解释时，必须更新文档中的变更记录和受影响 TODO。",
    "最终交付前应与 `verify-before-done` 之类的收尾验证流程衔接，确保计划完成状态和验证证据一致。"
  ],
  "reviewChecklist": [
    "是否真正理解了用户目标、验收标准、范围限制和隐含工作流？",
    "是否只询问了会影响实现方向的澄清问题，没有过度打扰用户？",
    "是否已创建或更新一份按需求功能维度分层的持久 TODO 文档，并向用户概述了执行内容？",
    "每个一级功能块是否已拆成原子化、可预测、上下文尽量纯净的子 TODO 或孙 TODO？",
    "每个原子 TODO 是否具备明确状态，开发过程中是否完成一项就更新一项？",
    "发现新范围、阻塞或假设变化时，文档是否同步更新并保持可追溯？"
  ],
  "references": [
    {
      "title": "Clarification Gate",
      "path": "references/clarification-gate.md",
      "description": "判断什么时候问用户、问几个问题、什么时候带假设继续。"
    },
    {
      "title": "TODO Document",
      "path": "references/todo-document.md",
      "description": "开发 TODO 文档结构、状态语义和更新节奏。"
    },
    {
      "title": "Examples",
      "path": "references/examples.md",
      "description": "典型需求开工前的澄清、TODO 文档和状态更新样例。"
    }
  ]
}
